{
  "hf": 1,
  "type": "task",
  "slug": "add-variant-selector",
  "title": "Add variant selector to product detail page",
  "status": "in_progress",
  "created": "2026-07-17",
  "updated": "2026-07-17",
  "specialists": ["frontend-reviewer", "accessibility-reviewer"],
  "payload": {
    "goal": "Let shoppers pick size and color on the product detail page and reflect the choice in the add-to-cart payload.",
    "scope": [
      { "surface": "Components", "files": 3, "created": 2, "modified": 1, "risk": "low" },
      { "surface": "State/hooks", "files": 2, "created": 1, "modified": 1, "risk": "medium" },
      { "surface": "Tests", "files": 2, "created": 2, "modified": 0, "risk": "low" }
    ],
    "batches": [
      {
        "name": "State + data",
        "parallel": true,
        "dependsOn": [],
        "tasks": [
          { "id": "T1", "role": "Implementer", "task": "Add useVariantSelection hook", "read": ["types/product.ts"], "modify": [], "create": ["hooks/useVariantSelection.ts"], "complexity": "medium", "specialist": "frontend-reviewer", "brief": "add-variant-selector/T1.md" },
          { "id": "T2", "role": "Implementer", "task": "Extend cart payload with variant id", "read": ["services/cart.ts"], "modify": ["services/cart.ts"], "create": [], "complexity": "low", "specialist": "frontend-reviewer" }
        ]
      },
      {
        "name": "UI",
        "parallel": true,
        "dependsOn": ["T1"],
        "tasks": [
          { "id": "T3", "role": "Implementer", "task": "VariantSelector component (radio group)", "read": [], "modify": [], "create": ["components/VariantSelector.tsx"], "complexity": "medium", "specialist": "accessibility-reviewer", "brief": "add-variant-selector/T3.md" }
        ]
      }
    ],
    "verification": ["npm run test -- VariantSelector", "npm run lint", "Playwright: pick size+color, add to cart, assert payload"],
    "commits": ["feat(pdp): add variant selection hook", "feat(pdp): add variant selector component"]
  }
}
